<?xml version="1.0" encoding="UTF-8"?>

<Assembly xmlns="http://exjobb18.cs.lth.se"
xmlns:xsi="http://www.w3.org/2001/XMLSchema-instance"
xsi:schemaLocation="http://exjobb18.cs.lth.se http://exjobb18.cs.lth.se/xml_format_in.xsd">
	<Trays>
		<Tray id="Top tray"/>
		<Tray id="Button tray"/>
		<Tray id="Ring tray"/>
		<Tray id="Switch tray"/>
	</Trays>

	<Fixtures>
		<Fixture id="Front fixture"/>
	</Fixtures>

	<Components>
		<Component id="Top"/>
		<Component id="Button"/>
		<Component id="Ring"/>
		<Component id="Bottom"/>
		<Component id="Switch"/>
		<Component id="Top-Button"/>
		<Component id="Top-Button-Ring"/>
		<Component id="Bottom-Switch"/>
		<Component id="Complete"/>
	</Components>

	<Tools>
		<Tool id="tool1"/>
		<Tool id="tool2"/>
	</Tools>

	<Machines>
		<Machine id="m1"/>
		<Machine id="m2"/>
	</Machines>

	<Tasks>
		<Task id="Take top" Duration="5" EndPos="4,9" StartPos="4,9">
			<Tray id="Top tray"/>
			<ComponentsUsed>
				<Component id="Top"/>
			</ComponentsUsed>
			<ToolNeeded id="tool1"/>
			<Action>Taking</Action>
		</Task>
		<Task id="Put top in fixture" Duration="10" EndPos="8,2" StartPos="8,2">
			<Fixture id="Front fixture"/>
			<ComponentsUsed>
				<Component id="Top"/>
			</ComponentsUsed>
			<ToolNeeded id="tool1"/>
			<Action>Putting</Action>
		</Task>
		<Task id="Take button" Duration="5" EndPos="5,2" StartPos="5,2">
			<Tray id="Button tray"/>
			<ComponentsUsed>
				<Component id="Button"/>
			</ComponentsUsed>
			<ToolNeeded id="tool1"/>
			<Action>Taking</Action>
		</Task>
		<Task id="Mount button on top" Duration="25" EndPos="8,2" StartPos="8,2">
			<Fixture id="Front fixture"/>
			<ComponentsUsed>
				<Component id="Top"/>
				<Component id="Button"/>
			</ComponentsUsed>
			<ComponentCreated id="Top-Button"/>
			<ToolNeeded id="tool1"/>
			<Action>Mounting</Action>
		</Task>
		<Task id="Take top-button from fixture" Duration="5" EndPos="8,2" StartPos="8,2">
			<Fixture id="Front fixture"/>
			<ComponentsUsed>
				<Component id="Top-Button"/>
			</ComponentsUsed>
			<ToolNeeded id="tool1"/>
			<Action>Taking</Action>
		</Task>
		<Task id="Angle top-bottom" Duration="5" EndPos="8,2" StartPos="8,2">
			<Fixture id="Front fixture"/>
			<ComponentsUsed>
				<Component id="Top-Button"/>
			</ComponentsUsed>
			<ToolNeeded id="tool1"/>
			<Action>Moving</Action>
		</Task>
		<Task id="Lift top-button, hold top-button" Duration="5" EndPos="7,9" StartPos="8,2">
			<ComponentsUsed>
				<Component id="Top-Button"/>
			</ComponentsUsed>
			<ToolNeeded id="tool1"/>
			<Action>Moving</Action>
		</Task>
		<Task id="Lift top-button, support" Duration="5" EndPos="7,9" StartPos="8,2">
			<ComponentsUsed>
				<Component id="Top-Button"/>
			</ComponentsUsed>
			<Action>Moving</Action>
		</Task>
		<Task id="Turn top-button" Duration="20" EndPos="7,9" StartPos="7,9">
			<ComponentsUsed>
				<Component id="Top-Button"/>
			</ComponentsUsed>
			<ToolNeeded id="tool1"/>
			<Action>Moving</Action>
		</Task>
		<Task id="Take ring" Duration="10" EndPos="14,9" StartPos="14,9">
			<Tray id="Ring tray"/>
			<ComponentsUsed>
				<Component id="Ring"/>
			</ComponentsUsed>
			<ToolNeeded id="tool1"/>
			<Action>Taking</Action>
		</Task>
		<Task id="Mount ring on top-button, hold" Duration="260" EndPos="7,9" StartPos="7,9">
			<ComponentsUsed>
				<Component id="Top-Button"/>
				<Component id="Ring"/>
			</ComponentsUsed>
			<ComponentCreated id="Top-Button-Ring"/>
			<ToolNeeded id="tool1"/>
			<Action>Mounting</Action>
		</Task>
		<Task id="Mount ring on top-button, mount" Duration="260" EndPos="7,9" StartPos="7,9">
			<ComponentsUsed>
				<Component id="Top-Button"/>
				<Component id="Ring"/>
			</ComponentsUsed>
			<ComponentCreated id="Top-Button-Ring"/>
			<ToolNeeded id="tool1"/>
			<Action>Mounting</Action>
		</Task>
		<Task id="Fixate top-button-ring" Duration="15" EndPos="9,2" StartPos="9,2">
			<Fixture id="Front fixture"/>
			<ComponentsUsed>
				<Component id="Top-Button-Ring"/>
			</ComponentsUsed>
			<ToolNeeded id="tool1"/>
			<Action>Moving</Action>
		</Task>
		<Task id="Put top-button-ring in top-tray" Duration="5" EndPos="4,9" StartPos="4,9">
			<Tray id="Top tray"/>
			<ComponentsUsed>
				<Component id="Top-Button-Ring"/>
			</ComponentsUsed>
			<ToolNeeded id="tool1"/>
			<Action>Putting</Action>
		</Task>
		<Task id="Change to bottom-grabber tool" Duration="60" EndPos="8,12" StartPos="8,12"/>
		<Task id="Take top-button-ring from top-tray" Duration="5" EndPos="4,9" StartPos="4,9">
			<Tray id="Top tray"/>
			<ComponentsUsed>
				<Component id="Top-Button-Ring"/>
			</ComponentsUsed>
			<ToolNeeded id="tool1"/>
			<Action>Taking</Action>
		</Task>
		<Task id="Take bottom" Duration="5" EndPos="11,9" StartPos="11,9">
			<Tray id="Bottom tray"/>
			<ComponentsUsed>
				<Component id="Bottom"/>
			</ComponentsUsed>
			<ToolNeeded id="tool2"/>
			<Action>Taking</Action>
		</Task>
		<Task id="Put bottom in fixture" Duration="10" EndPos="8,2" StartPos="8,2">
			<Fixture id="Front fixture"/>
			<ComponentsUsed>
				<Component id="Bottom"/>
			</ComponentsUsed>
			<ToolNeeded id="tool2"/>
			<Action>Putting</Action>
		</Task>
		<Task id="Take switch" Duration="5" EndPos="12,5" StartPos="12,5">
			<Tray id="Switch tray"/>
			<ComponentsUsed>
				<Component id="Switch"/>
			</ComponentsUsed>
			<ToolNeeded id="tool2"/>
			<Action>Taking</Action>
		</Task>
		<Task id="Mount switch in bottom" Duration="15" EndPos="8,2" StartPos="8,2">
			<Fixture id="Front fixture"/>
			<ComponentsUsed>
				<Component id="Bottom"/>
				<Component id="Switch"/>
			</ComponentsUsed>
			<ComponentCreated id="Bottom-Switch"/>
			<ToolNeeded id="tool2"/>
			<Action>Mounting</Action>
		</Task>
		<Task id="Take bottom-switch" Duration="0" EndPos="8,2" StartPos="8,2">
			<Fixture id="Front fixture"/>
			<ComponentsUsed>
				<Component id="Bottom-Switch"/>
			</ComponentsUsed>
			<ToolNeeded id="tool2"/>
			<Action>Taking</Action>
		</Task>
		<Task id="Put bottom-switch on table" Duration="5" EndPos="10,2" StartPos="10,2">
			<ComponentsUsed>
				<Component id="Bottom-Switch"/>
			</ComponentsUsed>
			<ToolNeeded id="tool2"/>
			<Action>Putting</Action>
		</Task>
		<Task id="Mount top-bottom on bottom-switch" Duration="15" EndPos="10,2" StartPos="10,2">
			<ComponentsUsed>
				<Component id="Top-Button"/>
				<Component id="Bottom-Switch"/>
			</ComponentsUsed>
			<ComponentCreated id="Complete"/>
			<ToolNeeded id="tool1"/>
			<Action>Mounting</Action>
		</Task>
	</Tasks>

	<Ordered>
		<Group>
			<Task id="Take top-button from fixture"/>
			<Task id="Angle top-button"/>
			<Task id="Lift top-button, hold top-button"/>
			<Task id="Turn top-button"/>
			<Task id="Mount ring on top-button, hold"/>
			<Task id="Fixate top-button"/>
			<Task id="Put top-button in top-tray"/>
		</Group>
	</Ordered>

	<Concurrent>
		<Group>
			<Task id="Lift top-button, hold top-button"/>
			<Task id="Lift top-button, support"/>
		</Group>
		<Group>
			<Task id="Mount ring on top-button, hold"/>
			<Task id="Mount ring on top-button, mount"/>
		</Group>
	</Concurrent>

	<ToolChanges>
		<Change TaskId="Change to bottom-grabber tool" ToolId="tool2"/>
	</ToolChanges>

	<DefaultTools>
		<Default MachineId="m1" ToolId="tool2"/>
		<Default MachineId="m2" ToolId="tool2"/>
	</DefaultTools>
</Assembly>
