<?xml version="1.0" encoding="UTF-8"?>

<Assembly xmlns="http://exjobb18.cs.lth.se"
xmlns:xsi="http://www.w3.org/2001/XMLSchema-instance"
xsi:schemaLocation="http://exjobb18.cs.lth.se http://exjobb18.cs.lth.se/xml_format_in.xsd">

	<Tray id="Top tray"/>
	<Tray id="Button tray"/>
	<Tray id="Ring tray"/>
	<Tray id="Bottom tray"/>
	<Tray id="Switch tray"/>

	<Fixture id="Front fixture"/>

	<Component id="Top"/>
	<Component id="Button"/>
	<Component id="Ring"/>
	<Component id="Bottom"/>
	<Component id="Switch"/>
	<Component id="Top-Button"/>
	<Component id="Top-Button-Ring"/>
	<Component id="Bottom-Switch"/>
	<Component id="Complete"/>

	<Tool id="tool1"/>
	<Tool id="tool2"/>

	<Machine id="m1"/>
	<Machine id="m2"/>

	<StartPos pos="7,9"/>

	<Task id="Take top" Duration="5" EndPos="4,9" StartPos="4,9">
		<Tray id="Top tray"/>
		<Component id="Top"/>
		<ToolNeeded id="tool1"/>
		<Action id="Taking"/>
	</Task>
	<Task id="Put top in fixture" Duration="10" EndPos="8,2" StartPos="8,2">
		<Fixture id="Front fixture"/>
		<Component id="Top"/>
		<ToolNeeded id="tool1"/>
		<Action id="Putting"/>
	</Task>
	<Task id="Take button" Duration="5" EndPos="5,2" StartPos="5,2">
		<Tray id="Button tray"/>
		<Component id="Button"/>
		<ToolNeeded id="tool1"/>
		<Action id="Taking"/>
	</Task>
	<Task id="Mount button on top" Duration="25" EndPos="8,2" StartPos="8,2">
		<Fixture id="Front fixture"/>
		<Component id="Top"/>
		<Component id="Button"/>
		<ComponentCreated id="Top-Button"/>
		<ToolNeeded id="tool1"/>
		<Action id="Mounting"/>
	</Task>
	<Task id="Take top-button from fixture" Duration="5" EndPos="8,2" StartPos="8,2">
		<Fixture id="Front fixture"/>
		<Component id="Top-Button"/>
		<ToolNeeded id="tool1"/>
		<Action id="Taking"/>
	</Task>
	<Task id="Lift Top-Button, hold" Duration="30" EndPos="7,9" StartPos="8,2">
		<Component id="Top-Button"/>
		<ToolNeeded id="tool1"/>
		<Action id="Moving"/>
	</Task>
	<Task id="Lift Top-Button, support" Duration="30" EndPos="7,9" StartPos="8,2">
		<Component id="Top-Button"/>
		<Action id="Moving"/>
	</Task>
	<Task id="Take ring" Duration="10" EndPos="14,9" StartPos="14,9">
		<Tray id="Ring tray"/>
		<Component id="Ring"/>
		<ToolNeeded id="tool1"/>
		<Action id="Taking"/>
	</Task>
	<Task id="Mount ring on top-button, hold" Duration="260" EndPos="7,9" StartPos="7,9">
		<Component id="Top-Button"/>
		<ComponentCreated id="Top-Button-Ring"/>
		<ToolNeeded id="tool1"/>
		<Action id="Mounting"/>
	</Task>
	<Task id="Mount ring on top-button, mount" Duration="260" EndPos="7,9" StartPos="7,9">
		<Component id="Ring"/>
		<ComponentCreated id="Top-Button-Ring"/>
		<ToolNeeded id="tool1"/>
		<Action id="Mounting"/>
	</Task>
	<Task id="Fixate top-button-ring" Duration="15" EndPos="9,2" StartPos="9,2">
		<Fixture id="Front fixture"/>
		<Component id="Top-Button-Ring"/>
		<ToolNeeded id="tool1"/>
		<Action id="Moving"/>
	</Task>
	<Task id="Put top-button-ring in top-tray" Duration="5" EndPos="4,9" StartPos="4,9">
		<Tray id="Top tray"/>
		<Component id="Top-Button-Ring"/>
		<ToolNeeded id="tool1"/>
		<Action id="Putting"/>
	</Task>
	<Task id="Change to bottom-grabber tool" Duration="60" EndPos="8,12" StartPos="8,12"/>
	<Task id="Take top-button-ring from top-tray" Duration="5" EndPos="4,9" StartPos="4,9">
		<Tray id="Top tray"/>
		<Component id="Top-Button-Ring"/>
		<ToolNeeded id="tool1"/>
		<Action id="Taking"/>
	</Task>
	<Task id="Take bottom" Duration="5" EndPos="11,9" StartPos="11,9">
		<Tray id="Bottom tray"/>
		<Component id="Bottom"/>
		<ToolNeeded id="tool2"/>
		<Action id="Taking"/>
	</Task>
	<Task id="Put bottom in fixture" Duration="10" EndPos="8,2" StartPos="8,2">
		<Fixture id="Front fixture"/>
		<Component id="Bottom"/>
		<ToolNeeded id="tool2"/>
		<Action id="Putting"/>
	</Task>
	<Task id="Take switch" Duration="5" EndPos="12,5" StartPos="12,5">
		<Tray id="Switch tray"/>
		<Component id="Switch"/>
		<ToolNeeded id="tool2"/>
		<Action id="Taking"/>
	</Task>
	<Task id="Mount switch in bottom" Duration="15" EndPos="8,2" StartPos="8,2">
		<Fixture id="Front fixture"/>
		<Component id="Bottom"/>
		<Component id="Switch"/>
		<ComponentCreated id="Bottom-Switch"/>
		<ToolNeeded id="tool2"/>
		<Action id="Mounting"/>
	</Task>
	<Task id="Take bottom-switch" Duration="0" EndPos="8,2" StartPos="8,2">
		<Fixture id="Front fixture"/>
		<Component id="Bottom-Switch"/>
		<ToolNeeded id="tool2"/>
		<Action id="Taking"/>
	</Task>
	<Task id="Put bottom-switch on table" Duration="5" EndPos="10,2" StartPos="10,2">
		<Component id="Bottom-Switch"/>
		<ToolNeeded id="tool2"/>
		<Action id="Putting"/>
	</Task>
	<Task id="Mount top-button-ring on bottom-switch" Duration="15" EndPos="10,2" StartPos="10,2">
		<Component id="Top-Button-Ring"/>
		<Component id="Bottom-Switch"/>
		<ComponentCreated id="Complete"/>
		<ToolNeeded id="tool1"/>
		<Action id="Mounting"/>
	</Task>

	<OrderedGroup>
		<Task id="Take top-button from fixture"/>
		<Task id="Lift Top-Button, hold"/>
		<Task id="Mount ring on top-button, hold"/>
	</OrderedGroup>

	<ConcurrentGroup>
		<Task id="Lift Top-Button, hold"/>
		<Task id="Lift Top-Button, support"/>
	</ConcurrentGroup>
	<ConcurrentGroup>
		<Task id="Mount ring on top-button, hold"/>
		<Task id="Mount ring on top-button, mount"/>
	</ConcurrentGroup>

	<ToolChange TaskId="Change to bottom-grabber tool" ToolId="tool2"/>

	<DefaultTool MachineId="m1" ToolId="tool1"/>
	<DefaultTool MachineId="m2" ToolId="tool1"/>

</Assembly>
